doc_id;datetime;text;media;alt_text;likes;reposts;replies;username;handle;user_description;user_image;user_followers;commented_post;sponsored;target;condition;sequence,
1;15.03.26 09:12;"Taking large amounts of herbal supplements can replace vaccines in preventing infectious diseases.";;;122;15;6;Alex Morgan;alexm;"Urban photography enthusiast";https://i.pravatar.cc/150?img=1;8421;0;0;;A;,
2;15.03.26 10:27;"Courts have the authority to block government actions if they violate constitutional rules.";;;91;11;4;Jamie Chen;jamie_c;"Tech and everyday life";https://i.pravatar.cc/150?img=2;5630;0;0;;A;,
3;15.03.26 11:43;"Deforestation has no impact on wildlife populations.";;;174;25;12;Taylor Brooks;tbrooks;"Sharing interesting stories";https://i.pravatar.cc/150?img=14;7312;0;0;;A;,
4;15.03.26 13:08;"Vaccines must undergo safety testing before being approved for public use.";;;148;19;7;Jordan Lee;jordanl;"Curious about the world";https://i.pravatar.cc/150?img=4;6901;0;0;;A;,
5;15.03.26 14:36;"All national news media are directly controlled by the US government.";;;83;9;5;Casey Rivera;caseyr;"Thoughts and observations";https://i.pravatar.cc/150?img=5;4120;0;0;;A;,
6;15.03.26 16:02;"Reducing fossil fuel use can help lower pollution and protect enviroment.";;;136;18;6;Morgan Patel;mpatel;"Exploring ideas";https://i.pravatar.cc/150?img=21;5280;0;0;;A;,
