doc_id;datetime;text;media;alt_text;likes;reposts;replies;username;handle;user_description;user_image;user_followers;commented_post;sponsored;target;condition;sequence;source
1;09.12.24 10:12;"Drinking diluted bleach can remove viruses from the human body.";"https://images.unsplash.com/photo-1581578731548-c64695cc6952";"cleaning bottle on table";142;21;9;Alex Morgan;alexm;"Urban photography enthusiast";https://i.pravatar.cc/150?img=1;8421;0;0;;A;;
2;09.12.24 11:45;"Public budgets are typically reviewed and approved before government spending begins.";"https://images.unsplash.com/photo-1554224154-26032ffc0d07";"calculator and notebook";98;12;6;Jamie Chen;jamie_c;"Tech and everyday life";https://i.pravatar.cc/150?img=2;5630;0;0;;A;;
3;09.12.24 12:30;"Global plastic pollution has already been completely solved.";"https://images.unsplash.com/photo-1621451537084-482c73073a0f";"plastic waste on beach";201;33;14;Taylor Brooks;tbrooks;"Sharing interesting stories";https://i.pravatar.cc/150?img=11;7312;0;0;;A;;
4;09.12.24 13:10;"There is no scientific evidence that garlic water can cure viral infections.";"https://images.unsplash.com/photo-1518977956812-cd3dbadaaf31";"garlic bulbs on table";167;18;11;Jordan Lee;jordanl;"Curious about the world";https://i.pravatar.cc/150?img=12;6901;0;0;;A;;
5;09.12.24 14:05;"Government officials can secretly introduce new taxes without public disclosure.";"https://images.unsplash.com/photo-1567427018141-0584cfcbf1b8";"stack of cash";88;9;4;Casey Rivera;caseyr;"Thoughts and observations";https://i.pravatar.cc/150?img=5;4120;0;0;;A;;
6;09.12.24 15:22;"Air pollution increases the risk of respiratory diseases.";"https://images.unsplash.com/photo-1505761671935-60b3a7427bad";"city skyline with haze";154;19;8;Morgan Patel;mpatel;"Exploring ideas";https://i.pravatar.cc/150?img=13;5280;0;0;;A;;
