doc_id;datetime;text;media;alt_text;likes;reposts;replies;username;handle;user_description;user_image;user_followers;commented_post;sponsored;target;condition;sequence;source
1;09.12.24 10:12;"Drinking diluted bleach can remove viruses from the human body.";"https://upload.wikimedia.org/wikipedia/commons/3/3f/Bleach_bottle.jpg";"household bleach bottle";142;21;9;Alex Morgan;alexm;"Urban photography enthusiast";https://i.pravatar.cc/150?img=1;8421;0;0;;A;;
2;09.12.24 11:45;"Public budgets are typically reviewed and approved before government spending begins.";"https://upload.wikimedia.org/wikipedia/commons/0/0c/Calculator_and_paper.jpg";"calculator and paperwork";98;12;6;Jamie Chen;jamie_c;"Tech and everyday life";https://i.pravatar.cc/150?img=2;5630;0;0;;A;;
3;09.12.24 12:30;"Global plastic pollution has already been completely solved.";"https://upload.wikimedia.org/wikipedia/commons/5/5e/Plastic_waste_on_beach.jpg";"plastic waste on beach";201;33;14;Taylor Brooks;tbrooks;"Sharing interesting stories";https://i.pravatar.cc/150?img=11;7312;0;0;;A;;
4;09.12.24 13:10;"There is no scientific evidence that garlic water can cure viral infections.";"https://upload.wikimedia.org/wikipedia/commons/2/2b/Garlic_cloves_garlic.jpg";"garlic cloves on cutting board";167;18;11;Jordan Lee;jordanl;"Curious about the world";https://i.pravatar.cc/150?img=12;6901;0;0;;A;;
5;09.12.24 14:05;"Government officials can secretly introduce new taxes without public disclosure.";"https://upload.wikimedia.org/wikipedia/commons/8/84/US_%24100_Bill_Obverse.jpg";"US dollar bill";88;9;4;Casey Rivera;caseyr;"Thoughts and observations";https://i.pravatar.cc/150?img=5;4120;0;0;;A;;
6;09.12.24 15:22;"Air pollution increases the risk of respiratory diseases.";"https://upload.wikimedia.org/wikipedia/commons/2/21/Smog_in_city.jpg";"city skyline with smog";154;19;8;Morgan Patel;mpatel;"Exploring ideas";https://i.pravatar.cc/150?img=13;5280;0;0;;A;;
